[
  {
    "venue": "Manchester Tribunal Centre",
    "appealReferenceNumber": "SC/123/2025",
    "hearingType": "Oral Hearing",
    "appellant": "Smith, John",
    "courtroom": "Room 1",
    "hearingTime": "10:00am",
    "tribunal": "SSCS",
    "respondent": "Secretary of State for Work and Pensions",
    "additionalInformation": "Video hearing"
  }
]
